{
  "reportDate": "2026-03-17",
  "publishDate": "2026-03-20",
  "source": "CFTC_LEGACY_TFF",
  "legacy": [
    {
      "currency": "USD",
      "noncomm_long": 45230,
      "noncomm_short": 21840,
      "open_interest": 142000,
      "net": 23390,
      "net_delta_1w": 1250,
      "cot_index_52w": 72,
      "extreme_flag": false,
      "flip_flag": false
    },
    {
      "currency": "EUR",
      "noncomm_long": 98450,
      "noncomm_short": 85900,
      "open_interest": 524000,
      "net": 12550,
      "net_delta_1w": -4200,
      "cot_index_52w": 41,
      "extreme_flag": false,
      "flip_flag": false
    },
    {
      "currency": "GBP",
      "noncomm_long": 62300,
      "noncomm_short": 31200,
      "open_interest": 218000,
      "net": 31100,
      "net_delta_1w": 6700,
      "cot_index_52w": 78,
      "extreme_flag": false,
      "flip_flag": true
    },
    {
      "currency": "JPY",
      "noncomm_long": 17800,
      "noncomm_short": 107000,
      "open_interest": 268000,
      "net": -89200,
      "net_delta_1w": -3100,
      "cot_index_52w": 4,
      "extreme_flag": true,
      "flip_flag": false
    },
    {
      "currency": "AUD",
      "noncomm_long": 38400,
      "noncomm_short": 44600,
      "open_interest": 156000,
      "net": -6200,
      "net_delta_1w": 800,
      "cot_index_52w": 38,
      "extreme_flag": false,
      "flip_flag": false
    },
    {
      "currency": "CAD",
      "noncomm_long": 22100,
      "noncomm_short": 48700,
      "open_interest": 168000,
      "net": -26600,
      "net_delta_1w": -1900,
      "cot_index_52w": 22,
      "extreme_flag": false,
      "flip_flag": false
    },
    {
      "currency": "CHF",
      "noncomm_long": 8900,
      "noncomm_short": 12400,
      "open_interest": 62000,
      "net": -3500,
      "net_delta_1w": 400,
      "cot_index_52w": 47,
      "extreme_flag": false,
      "flip_flag": false
    },
    {
      "currency": "NZD",
      "noncomm_long": 28700,
      "noncomm_short": 18400,
      "open_interest": 72000,
      "net": 10300,
      "net_delta_1w": 4100,
      "cot_index_52w": 66,
      "extreme_flag": false,
      "flip_flag": true
    }
  ],
  "tff": [
    {
      "currency": "EUR",
      "lev_funds_long": 54200,
      "lev_funds_short": 62800,
      "lev_funds_net": -8600,
      "asset_mgr_long": 44250,
      "asset_mgr_short": 23100,
      "asset_mgr_net": 21150,
      "dealer_long": 38100,
      "dealer_short": 52400,
      "dealer_net": -14300,
      "lev_vs_assetmgr_divergence": 2.3
    },
    {
      "currency": "JPY",
      "lev_funds_long": 8200,
      "lev_funds_short": 71400,
      "lev_funds_net": -63200,
      "asset_mgr_long": 9600,
      "asset_mgr_short": 35600,
      "asset_mgr_net": -26000,
      "dealer_long": 48900,
      "dealer_short": 21200,
      "dealer_net": 27700,
      "lev_vs_assetmgr_divergence": 0.8
    }
  ],
  "cot_indices": {
    "USD": { "index": 72, "trend_12w": [55, 58, 60, 62, 63, 65, 68, 69, 70, 71, 72, 72] },
    "EUR": { "index": 41, "trend_12w": [65, 62, 58, 55, 52, 50, 48, 45, 44, 43, 42, 41] },
    "GBP": { "index": 78, "trend_12w": [40, 42, 45, 50, 55, 58, 61, 65, 70, 72, 76, 78] },
    "JPY": { "index": 4, "trend_12w": [30, 25, 20, 18, 15, 12, 10, 8, 7, 5, 4, 4] },
    "AUD": { "index": 38, "trend_12w": [45, 43, 42, 40, 39, 38, 37, 38, 40, 39, 38, 38] },
    "CAD": { "index": 22, "trend_12w": [40, 38, 35, 32, 29, 27, 25, 24, 23, 23, 22, 22] },
    "CHF": { "index": 47, "trend_12w": [50, 48, 47, 46, 47, 48, 47, 46, 47, 48, 47, 47] },
    "NZD": { "index": 66, "trend_12w": [35, 38, 42, 45, 48, 52, 55, 58, 60, 63, 64, 66] }
  }
}
