{
  "reportDate": "2026-07-07",
  "publishDate": "2026-07-10",
  "source": "CFTC_LEGACY_TFF",
  "legacy": [
    {
      "currency": "EUR",
      "noncomm_long": 235658,
      "noncomm_short": 234559,
      "open_interest": 790076,
      "net": 1099,
      "net_delta_1w": -29059,
      "cot_index_52w": 4.6,
      "extreme_flag": true,
      "flip_flag": false
    },
    {
      "currency": "GBP",
      "noncomm_long": 37149,
      "noncomm_short": 139296,
      "open_interest": 295062,
      "net": -102147,
      "net_delta_1w": 3572,
      "cot_index_52w": 2.57,
      "extreme_flag": true,
      "flip_flag": false
    },
    {
      "currency": "JPY",
      "noncomm_long": 111872,
      "noncomm_short": 266964,
      "open_interest": 438825,
      "net": -155092,
      "net_delta_1w": -8988,
      "cot_index_52w": 0.0,
      "extreme_flag": true,
      "flip_flag": false
    },
    {
      "currency": "AUD",
      "noncomm_long": 77788,
      "noncomm_short": 95488,
      "open_interest": 215837,
      "net": -17700,
      "net_delta_1w": -4688,
      "cot_index_52w": 44.51,
      "extreme_flag": false,
      "flip_flag": false
    },
    {
      "currency": "CAD",
      "noncomm_long": 37989,
      "noncomm_short": 188795,
      "open_interest": 346500,
      "net": -150806,
      "net_delta_1w": -4014,
      "cot_index_52w": 4.45,
      "extreme_flag": true,
      "flip_flag": false
    },
    {
      "currency": "CHF",
      "noncomm_long": 7975,
      "noncomm_short": 46933,
      "open_interest": 105912,
      "net": -38958,
      "net_delta_1w": 2136,
      "cot_index_52w": 23.82,
      "extreme_flag": false,
      "flip_flag": false
    },
    {
      "currency": "NZD",
      "noncomm_long": 11581,
      "noncomm_short": 74861,
      "open_interest": 110331,
      "net": -63280,
      "net_delta_1w": -8436,
      "cot_index_52w": 0.0,
      "extreme_flag": true,
      "flip_flag": false
    },
    {
      "currency": "USD",
      "noncomm_long": 32524,
      "noncomm_short": 19508,
      "open_interest": 54306,
      "net": 13016,
      "net_delta_1w": 88,
      "cot_index_52w": 99.39,
      "extreme_flag": true,
      "flip_flag": false
    }
  ],
  "tff": [
    {
      "currency": "EUR",
      "lev_funds_long": 102267,
      "lev_funds_short": 134911,
      "lev_funds_net": -32644,
      "asset_mgr_long": 470602,
      "asset_mgr_short": 215444,
      "asset_mgr_net": 255158,
      "dealer_long": 39903,
      "dealer_short": 293368,
      "dealer_net": -253465,
      "lev_vs_assetmgr_divergence": -1.1279
    },
    {
      "currency": "GBP",
      "lev_funds_long": 52097,
      "lev_funds_short": 35824,
      "lev_funds_net": 16273,
      "asset_mgr_long": 12147,
      "asset_mgr_short": 168454,
      "asset_mgr_net": -156307,
      "dealer_long": 193859,
      "dealer_short": 33934,
      "dealer_net": 159925,
      "lev_vs_assetmgr_divergence": 1.1041
    },
    {
      "currency": "JPY",
      "lev_funds_long": 87437,
      "lev_funds_short": 202837,
      "lev_funds_net": -115400,
      "asset_mgr_long": 71903,
      "asset_mgr_short": 140596,
      "asset_mgr_net": -68693,
      "dealer_long": 142623,
      "dealer_short": 13205,
      "dealer_net": 129418,
      "lev_vs_assetmgr_divergence": -0.4047
    },
    {
      "currency": "AUD",
      "lev_funds_long": 64136,
      "lev_funds_short": 32359,
      "lev_funds_net": 31777,
      "asset_mgr_long": 53713,
      "asset_mgr_short": 92920,
      "asset_mgr_net": -39207,
      "dealer_long": 52629,
      "dealer_short": 64020,
      "dealer_net": -11391,
      "lev_vs_assetmgr_divergence": 1.8105
    },
    {
      "currency": "CAD",
      "lev_funds_long": 36456,
      "lev_funds_short": 124557,
      "lev_funds_net": -88101,
      "asset_mgr_long": 50641,
      "asset_mgr_short": 131885,
      "asset_mgr_net": -81244,
      "dealer_long": 200285,
      "dealer_short": 33043,
      "dealer_net": 167242,
      "lev_vs_assetmgr_divergence": -0.0778
    },
    {
      "currency": "CHF",
      "lev_funds_long": 8199,
      "lev_funds_short": 17865,
      "lev_funds_net": -9666,
      "asset_mgr_long": 7019,
      "asset_mgr_short": 48348,
      "asset_mgr_net": -41329,
      "dealer_long": 74658,
      "dealer_short": 8702,
      "dealer_net": 65956,
      "lev_vs_assetmgr_divergence": 0.7661
    },
    {
      "currency": "NZD",
      "lev_funds_long": 8260,
      "lev_funds_short": 33545,
      "lev_funds_net": -25285,
      "asset_mgr_long": 7332,
      "asset_mgr_short": 64542,
      "asset_mgr_net": -57210,
      "dealer_long": 88473,
      "dealer_short": 2344,
      "dealer_net": 86129,
      "lev_vs_assetmgr_divergence": 0.558
    },
    {
      "currency": "USD",
      "lev_funds_long": 15604,
      "lev_funds_short": 21184,
      "lev_funds_net": -5580,
      "asset_mgr_long": 22171,
      "asset_mgr_short": 2110,
      "asset_mgr_net": 20061,
      "dealer_long": 4520,
      "dealer_short": 25890,
      "dealer_net": -21370,
      "lev_vs_assetmgr_divergence": -1.2782
    }
  ],
  "cot_indices": {
    "EUR": {
      "index": 4.6,
      "trend_12w": [
        0.0,
        60.83,
        69.62,
        26.87,
        100.0,
        59.3,
        67.86,
        81.86,
        65.11,
        72.46,
        84.21,
        52.17
      ]
    },
    "GBP": {
      "index": 2.57,
      "trend_12w": [
        5.7,
        0.0,
        54.47,
        66.24,
        85.38,
        70.73,
        66.09,
        100.0,
        66.73,
        71.94,
        85.67,
        81.38
      ]
    },
    "JPY": {
      "index": 0.0,
      "trend_12w": [
        0.0,
        9.63,
        5.31,
        9.93,
        27.34,
        43.3,
        65.54,
        85.68,
        100.0,
        56.81,
        64.95,
        77.0
      ]
    },
    "AUD": {
      "index": 44.51,
      "trend_12w": [
        0.0,
        4.54,
        13.14,
        34.7,
        57.59,
        75.34,
        100.0,
        99.37,
        93.26,
        86.67,
        79.85,
        80.1
      ]
    },
    "CAD": {
      "index": 4.45,
      "trend_12w": [
        0.0,
        2.95,
        13.15,
        22.63,
        41.64,
        60.17,
        87.83,
        98.84,
        100.0,
        82.51,
        67.55,
        53.28
      ]
    },
    "CHF": {
      "index": 23.82,
      "trend_12w": [
        26.1,
        0.0,
        12.66,
        54.11,
        100.0,
        72.74,
        50.79,
        59.83,
        80.31,
        71.75,
        95.55,
        85.49
      ]
    },
    "NZD": {
      "index": 0.0,
      "trend_12w": [
        0.0,
        24.08,
        51.72,
        90.51,
        100.0,
        83.07,
        64.7,
        68.88,
        42.9,
        48.4,
        42.32,
        59.95
      ]
    },
    "USD": {
      "index": 99.39,
      "trend_12w": [
        98.68,
        98.03,
        100.0,
        13.62,
        30.98,
        9.72,
        0.0,
        26.81,
        8.57,
        36.47,
        39.94,
        41.31
      ]
    }
  }
}